{
  "$schema": "./schema.json",
  "name": "AISecDB",
  "description": "AI 安全知识图谱数据集：企业、开源项目、文章与专栏、标准与数据集，以及它们之间的标签关系。",
  "updated": "2026-10-21",
  "sections": [
    {
      "key": "companies",
      "zh": "AI 安全公司",
      "en": "Companies",
      "color": "#F72585",
      "desc": "做 AI 安全产品的商业公司。按防护面看：模型层、推理层、Agent 层，三层各有玩家。",
      "desc_en": "Commercial vendors, grouped by where they sit: the model layer, the inference layer, or the agent layer."
    },
    {
      "key": "opensource",
      "zh": "开源项目",
      "en": "Open Source",
      "color": "#8338EC",
      "desc": "能自己跑起来的工具。数据与 Scanners-Box 每日推荐同源，star 数取自 GitHub。",
      "desc_en": "Tools you can run yourself. Same source as the Scanners-Box daily column; star counts come from GitHub."
    },
    {
      "key": "articles",
      "zh": "文章与专栏",
      "en": "Articles",
      "color": "#06D6A0",
      "desc": "值得读的深度内容：技术拆解、威胁分析、行业报告。不收新闻稿。",
      "desc_en": "Long-form worth reading: technical teardowns, threat analysis, industry reports. No press releases."
    },
    {
      "key": "resources",
      "zh": "标准与数据集",
      "en": "Standards & Datasets",
      "color": "#FB5607",
      "desc": "框架、威胁矩阵、评测集 —— 写方案和做检测时绕不开的那几份。",
      "desc_en": "Frameworks, threat matrices and eval sets — the handful you cannot avoid when writing a plan or building detections."
    }
  ],
  "entries": [
    {
      "name": "Protect AI",
      "url": "https://protectai.com",
      "section": "companies",
      "logo": "assets/logos/org-protectai.png",
      "region": "US",
      "status": "featured",
      "tags": [
        "模型安全",
        "LLM 防护"
      ],
      "desc": "模型扫描 + LLM 运行时防护的 AI/ML 安全平台。少数自己写开源工具的厂商：llm-guard、rebuff 都出自这里。",
      "desc_en": "Model scanning plus LLM runtime protection. One of the few vendors that ships its own open source: llm-guard and rebuff both came out of here.",
      "added": "2026-10-21"
    },
    {
      "name": "Zenity",
      "url": "https://zenity.io",
      "section": "companies",
      "logo": "assets/logos/zenity-io.ico",
      "region": "IL",
      "status": "featured",
      "tags": [
        "Agent 管控",
        "Copilot"
      ],
      "desc": "从 Copilot / Power Platform 起家的 Agent 安全，把企业里成百上千个 agent 当成一个新攻击面来管。",
      "desc_en": "Agent security that started with Copilot and the Power Platform, treating the hundreds of agents inside an enterprise as one new attack surface.",
      "added": "2026-10-21"
    },
    {
      "name": "瑞莱智慧 RealAI",
      "url": "https://www.realai.ai",
      "section": "companies",
      "logo": "assets/logos/realai-ai.ico",
      "region": "CN",
      "status": "featured",
      "tags": [
        "对抗攻防",
        "模型安全"
      ],
      "desc": "清华背景，做对抗攻防与 AI 基础设施安全，国内少数把对抗样本研究真正做成产品的团队。",
      "desc_en": "Out of Tsinghua; adversarial attack and defense plus AI infrastructure security. One of the few Chinese teams that turned adversarial-example research into a product.",
      "added": "2026-10-21"
    },
    {
      "name": "Lakera",
      "url": "https://www.lakera.ai",
      "section": "companies",
      "logo": "assets/logos/lakera-ai.png",
      "region": "CH",
      "tags": [
        "提示注入",
        "LLM 防护"
      ],
      "desc": "从提示注入检测起家（Lakera Guard）。Gandalf 那个让上百万人试着越狱的小游戏就是他们做的。",
      "desc_en": "Started with prompt-injection detection (Lakera Guard). They also made Gandalf, the game that got a million people attempting jailbreaks.",
      "added": "2026-10-21"
    },
    {
      "name": "HiddenLayer",
      "url": "https://hiddenlayer.com",
      "section": "companies",
      "logo": "assets/logos/hiddenlayer-com.png",
      "region": "US",
      "tags": [
        "模型安全",
        "MLDR"
      ],
      "desc": "MLDR（机器学习检测与响应）的提出者，主打模型扫描：把恶意模型文件当样本查。",
      "desc_en": "Coined MLDR (machine learning detection and response). Their focus is model scanning — treating a malicious model file as the sample.",
      "added": "2026-10-21"
    },
    {
      "name": "Robust Intelligence",
      "url": "https://www.robustintelligence.com",
      "section": "companies",
      "region": "US",
      "tags": [
        "AI 防火墙",
        "红队"
      ],
      "desc": "AI Firewall + 算法红队，偏合规与大模型上线前的系统性验证。",
      "desc_en": "AI Firewall plus algorithmic red teaming, leaning toward compliance and systematic pre-deployment validation.",
      "added": "2026-10-21"
    },
    {
      "name": "CalypsoAI",
      "url": "https://calypsoai.com",
      "section": "companies",
      "region": "US",
      "tags": [
        "推理安全",
        "Agent 管控"
      ],
      "desc": "推理安全平台，把扫描器、护栏、Agent 管控编排成一整套推理层。",
      "desc_en": "An inference-security platform that orchestrates scanners, guardrails and agent controls into one inference layer.",
      "added": "2026-10-21"
    },
    {
      "name": "Prompt Security",
      "url": "https://www.prompt.security",
      "section": "companies",
      "logo": "assets/logos/prompt-security.png",
      "region": "IL",
      "tags": [
        "网关",
        "影子 AI"
      ],
      "desc": "GenAI 安全网关，覆盖面从员工偷偷用 ChatGPT 到企业自研应用，影子 AI 是它的切入点。",
      "desc_en": "A GenAI security gateway spanning employees using ChatGPT on the side all the way to in-house apps; shadow AI is the wedge.",
      "added": "2026-10-21"
    },
    {
      "name": "Noma Security",
      "url": "https://www.nomasecurity.com",
      "section": "companies",
      "logo": "assets/logos/nomasecurity-com.png",
      "region": "IL",
      "tags": [
        "Agent 管控",
        "全生命周期"
      ],
      "desc": "AI 与 Agent 的全生命周期安全：数据、模型、应用、agent，SDLC 两端都管。",
      "desc_en": "Full-lifecycle AI and agent security — data, models, applications and agents, covering both ends of the SDLC.",
      "added": "2026-10-21"
    },
    {
      "name": "Lasso Security",
      "url": "https://www.lasso.security",
      "section": "companies",
      "logo": "assets/logos/lasso-security.png",
      "region": "IL",
      "tags": [
        "网关",
        "MCP"
      ],
      "desc": "GenAI 与 MCP 网关，思路是给 agent 的工具调用装一层代理。",
      "desc_en": "GenAI and MCP gateway; the idea is to put a proxy in front of an agent's tool calls.",
      "added": "2026-10-21"
    },
    {
      "name": "Operant AI",
      "url": "https://operant.ai",
      "section": "companies",
      "logo": "assets/logos/operant-ai.png",
      "region": "US",
      "tags": [
        "运行时管控",
        "MCP"
      ],
      "desc": "Kubernetes 运行时出身，现在做 Agentic AI 与 MCP 流量的在环防护。",
      "desc_en": "Came out of Kubernetes runtime protection; now does inline defense for agentic AI and MCP traffic.",
      "added": "2026-10-21"
    },
    {
      "name": "Aporia",
      "url": "https://www.aporia.com",
      "section": "companies",
      "region": "IL",
      "tags": [
        "可观测",
        "护栏"
      ],
      "desc": "ML 可观测与护栏，偏生产环境的模型监控加 LLM 输出拦截。",
      "desc_en": "ML observability and guardrails, focused on production model monitoring plus LLM output blocking.",
      "added": "2026-10-21"
    },
    {
      "name": "Fiddler AI",
      "url": "https://www.fiddler.ai",
      "section": "companies",
      "logo": "assets/logos/fiddler-ai.png",
      "region": "US",
      "tags": [
        "可观测",
        "评估"
      ],
      "desc": "LLM/ML 可观测与评估平台，强项是把模型表现和安全事件放进同一个看板。",
      "desc_en": "An LLM/ML observability and evaluation platform; its strength is putting model behaviour and security events on one dashboard.",
      "added": "2026-10-21"
    },
    {
      "name": "Arthur AI",
      "url": "https://www.arthur.ai",
      "section": "companies",
      "region": "US",
      "tags": [
        "护栏",
        "评估"
      ],
      "desc": "Arthur Shield 做运行时防护，Arthur Bench 做模型对比评估。",
      "desc_en": "Arthur Shield for runtime protection, Arthur Bench for model comparison and evaluation.",
      "added": "2026-10-21"
    },
    {
      "name": "Knostic",
      "url": "https://www.knostic.ai",
      "section": "companies",
      "logo": "assets/logos/knostic-ai.svg",
      "region": "US",
      "tags": [
        "RAG",
        "访问控制"
      ],
      "desc": "RAG 与知识库的最小权限访问控制，解决「检索把不该看的文档喂给了模型」。",
      "desc_en": "Least-privilege access control for RAG and knowledge bases — fixing the case where retrieval hands the model a document it should never see.",
      "added": "2026-10-21"
    },
    {
      "name": "Straiker",
      "url": "https://straiker.ai",
      "section": "companies",
      "logo": "assets/logos/straiker-ai.jpg",
      "region": "US",
      "tags": [
        "红队",
        "运行时管控"
      ],
      "desc": "GenAI 红队 + 运行时防护一体，从上线前评测到上线后拦截。",
      "desc_en": "GenAI red teaming and runtime protection in one, from pre-deployment evaluation to post-deployment blocking.",
      "added": "2026-10-21"
    },
    {
      "name": "mcp-scanner",
      "url": "https://github.com/cisco-ai-defense/mcp-scanner",
      "section": "opensource",
      "logo": "assets/logos/org-cisco-ai-defense.png",
      "star": 1094,
      "github": "cisco-ai-defense/mcp-scanner",
      "tags": [
        "智能体审计"
      ],
      "desc": "Cisco 开源的 MCP 服务器安检：YARA + LLM + AI Defense 三引擎并联，共 9 个分析器；最值钱的是报告纪律——扫描没跑完 is_safe 返回 None，不许说安全",
      "desc_en": "Cisco's open-source security screening for MCP servers — YARA + LLM + AI Defense in parallel, nine analyzers; the real prize is the reporting discipline: an unfinished scan returns is_safe=None, never \"safe\"",
      "post": "https://we5ter.github.io/ai-tools/mcp-scanner/",
      "added": "2026-10-19"
    },
    {
      "name": "agent-sandbox",
      "url": "https://github.com/kubernetes-sigs/agent-sandbox",
      "section": "opensource",
      "logo": "assets/logos/org-kubernetes-sigs.png",
      "star": 4270,
      "github": "kubernetes-sigs/agent-sandbox",
      "tags": [
        "运行时管控"
      ],
      "desc": "Kubernetes SIG Apps 官方出品：把「一个长期活着、有稳定名字、带自己磁盘的单容器」补成 Sandbox 这层 API，隔离一行代码都不自己写，全交给 gVisor / Kata",